{
  "$schema": "schema.json",
  "database_version": "0.0.3",
  "last_updated": "2026-06-06",
  "samples": [
    {
      "sample_id": "valerie_group1_h2o",
      "solvent": "10% D2O",
      "authors": [
        {
          "name": "Chris Waudby",
          "email": "c.waudby@ucl.ac.uk",
          "orcid": "0000-0001-7810-3753",
          "affiliation": "UCL School of Pharmacy"
        }
      ],
      "date_measured": "2025-11-28",
      "reference_temperature_K": 298.0,
      "reference_ionic_strength_M": 0.0,
      "measurement_ranges": {
        "pH": {
          "min": 3.4,
          "max": 10.0
        },
        "temperature_K": {
          "min": 283,
          "max": 310
        },
        "ionic_strength_M": {
          "min": 0.0,
          "max": 0.3
        }
      },
      "temperature_calibration": "d4-methanol chemical shift thermometer",
      "pH_calibration": "Hanna HI-2002 Edge pH Meter, calibrated against NIST-traceable buffers pH 4.01, 7.00, 10.01, thermostatted at 298 K",
      "ionic_strength_control": "Addition of 0, 150 or 300 mM NaCl"
    }
  ],
  "buffers": [
    {
      "buffer_name": "Imidazole",
      "smiles": "C1=CN=CN1",
      "sample_id": "valerie_group1_h2o",
      "ionisation_states": 2,
      "pKa_parameters": [
        {
          "pKa_index": 1,
          "pKa": [
            7.1822,
            0.0089
          ],
          "ΔH_kJ_mol": [
            -11.1434,
            0.2205
          ],
          "protonated_charge": 1,
          "davies_prefactor": [
            0.1207,
            0.0304
          ]
        }
      ],
      "chemical_shifts": {
        "1H": [
          {
            "resonance_id": "Ha",
            "description": "",
            "multiplicity": "singlet",
            "limiting_shifts": [
              {
                "ionisation_state": 0,
                "shift_ppm": [
                  8.66947,
                  0.00159
                ],
                "temperature_coefficient_ppm_per_K": [
                  -0.00047,
                  0.00008
                ],
                "ionic_strength_coefficient_ppm_per_M": [
                  0.03146,
                  0.00758
                ]
              },
              {
                "ionisation_state": 1,
                "shift_ppm": [
                  7.76789,
                  0.00196
                ],
                "temperature_coefficient_ppm_per_K": [
                  0.00102,
                  0.00011
                ],
                "ionic_strength_coefficient_ppm_per_M": [
                  0.02361,
                  0.00936
                ]
              }
            ]
          },
          {
            "resonance_id": "Hb",
            "description": "",
            "multiplicity": "singlet",
            "limiting_shifts": [
              {
                "ionisation_state": 0,
                "shift_ppm": [
                  7.46761,
                  0.00149
                ],
                "temperature_coefficient_ppm_per_K": [
                  0.00032,
                  0.00008
                ],
                "ionic_strength_coefficient_ppm_per_M": [
                  0.02360,
                  0.00707
                ]
              },
              {
                "ionisation_state": 1,
                "shift_ppm": [
                  7.12636,
                  0.00176
                ],
                "temperature_coefficient_ppm_per_K": [
                  0.00078,
                  0.00009
                ],
                "ionic_strength_coefficient_ppm_per_M": [
                  0.01593,
                  0.00843
                ]
              }
            ]
          }
        ]
      },
      "notes": "Testing - not final dataset."
    }
  ]
}